{
"id": "cqupt:fenghua@vp1",
"name": "风华运动场:虚拟路线1",
"description": "重庆邮电大学-风华运动场-虚拟路线1",
"version": 1,
"author": "Silver Wolf",
"coordinate_type": "GCJ02",
"points": [
{"lat": 29.532289496527778, "lng": 106.60705593532987},
{"lat": 29.53225830078125, "lng": 106.60705593532987},
{"lat": 29.532228461371528, "lng": 106.60705783420138},
{"lat": 29.53219943576389, "lng": 106.60706081814236},
{"lat": 29.532169325086805, "lng": 106.60706597222222},
{"lat": 29.53213650173611, "lng": 106.60708089192708},
{"lat": 29.532106391059028, "lng": 106.60710883246527},
{"lat": 29.532081434461805, "lng": 106.60713785807292},
{"lat": 29.532064344618057, "lng": 106.60717095269098},
{"lat": 29.53205132378472, "lng": 106.60720594618056},
{"lat": 29.53203830295139, "lng": 106.60723578559028},
{"lat": 29.53202826605903, "lng": 106.6072677951389},
{"lat": 29.53202338324653, "lng": 106.60730387369792},
{"lat": 29.5320263671875, "lng": 106.60734320746528},
{"lat": 29.532021484375, "lng": 106.60737928602431},
{"lat": 29.53201144748264, "lng": 106.60741807725694},
{"lat": 29.532003309461807, "lng": 106.60745307074653},
{"lat": 29.531996256510418, "lng": 106.60748806423611},
{"lat": 29.531993272569444, "lng": 106.60751925998264},
{"lat": 29.53198947482639, "lng": 106.60754909939236},
{"lat": 29.531988389756943, "lng": 106.60758110894098},
{"lat": 29.531988389756943, "lng": 106.60761420355902},
{"lat": 29.531988389756943, "lng": 106.60764838324653},
{"lat": 29.53199435763889, "lng": 106.60767849392361},
{"lat": 29.532003309461807, "lng": 106.60770833333333},
{"lat": 29.53200927734375, "lng": 106.60773844401042},
{"lat": 29.532019314236113, "lng": 106.60777452256944},
{"lat": 29.53203125, "lng": 106.60780653211806},
{"lat": 29.53204427083333, "lng": 106.60783447265625},
{"lat": 29.53206325954861, "lng": 106.607861328125},
{"lat": 29.532081434461805, "lng": 106.60788655598958},
{"lat": 29.53209933810764, "lng": 106.60790934244791},
{"lat": 29.53211941189236, "lng": 106.6079296875},
{"lat": 29.532141384548613, "lng": 106.60794976128473},
{"lat": 29.53216634114583, "lng": 106.60797173394097},
{"lat": 29.53219455295139, "lng": 106.60799370659723},
{"lat": 29.5322265625, "lng": 106.60801161024305},
{"lat": 29.532256673177084, "lng": 106.6080287000868},
{"lat": 29.532284613715277, "lng": 106.60803682204861},
{"lat": 29.53231363932292, "lng": 106.6080385876736},
{"lat": 29.532339680989583, "lng": 106.60803674175348},
{"lat": 29.532373589409723, "lng": 106.60803370486111},
{"lat": 29.53240966796875, "lng": 106.60802680121527},
{"lat": 29.53244466145833, "lng": 106.60801161024305},
{"lat": 29.532479654947917, "lng": 106.60800482855903},
{"lat": 29.532513563368056, "lng": 106.60800672743055},
{"lat": 29.532544759114582, "lng": 106.60801161024305},
{"lat": 29.53257351345486, "lng": 106.60801378038194},
{"lat": 29.532601725260417, "lng": 106.60801974826389},
{"lat": 29.53263156467014, "lng": 106.60802164713542},
{"lat": 29.53266167534722, "lng": 106.60802164713542},
{"lat": 29.532686631944443, "lng": 106.6080238172743},
{"lat": 29.532711588541666, "lng": 106.60802978515625},
{"lat": 29.532738715277777, "lng": 106.60803873697917},
{"lat": 29.532773708767362, "lng": 106.60803960373265},
{"lat": 29.532808702256943, "lng": 106.60804174175348},
{"lat": 29.53284884982639, "lng": 106.60804265668402},
{"lat": 29.532888997395833, "lng": 106.60804174175348},
{"lat": 29.53292697482639, "lng": 106.6080408107639},
{"lat": 29.532958984375, "lng": 106.60803870486111},
{"lat": 29.533017035590277, "lng": 106.60803168402778},
{"lat": 29.533044976128473, "lng": 106.60803168402778},
{"lat": 29.533074815538196, "lng": 106.6080287000868},
{"lat": 29.533103841145834, "lng": 106.60802463107639},
{"lat": 29.5331298828125, "lng": 106.60802680121527},
{"lat": 29.53315700954861, "lng": 106.6080287000868},
{"lat": 29.53318386501736, "lng": 106.60802463107639},
{"lat": 29.533208821614583, "lng": 106.6080238172743},
{"lat": 29.533234049479166, "lng": 106.6080238172743},
{"lat": 29.53325900607639, "lng": 106.6080238172743},
{"lat": 29.533286946614584, "lng": 106.6080238172743},
{"lat": 29.533314887152777, "lng": 106.60802164713542},
{"lat": 29.533339029947918, "lng": 106.60801459418403},
{"lat": 29.533364800347222, "lng": 106.60800862630208},
{"lat": 29.533388943142363, "lng": 106.6079966905382},
{"lat": 29.533414984809028, "lng": 106.60798366970486},
{"lat": 29.53344482421875, "lng": 106.60796359592014},
{"lat": 29.533471950954862, "lng": 106.60794460720486},
{"lat": 29.533495008680557, "lng": 106.60792182074653},
{"lat": 29.533518880208334, "lng": 106.60788981119792},
{"lat": 29.5335400390625, "lng": 106.60785481770833},
{"lat": 29.53355685763889, "lng": 106.60781955295138},
{"lat": 29.53356879340278, "lng": 106.6077845594618},
{"lat": 29.533578830295138, "lng": 106.60774929470486},
{"lat": 29.533584798177085, "lng": 106.6077183702257},
{"lat": 29.533591851128474, "lng": 106.60768636067708},
{"lat": 29.533594021267362, "lng": 106.60764946831597},
{"lat": 29.533599989149305, "lng": 106.60761149088542},
{"lat": 29.533607042100694, "lng": 106.60757134331597},
{"lat": 29.533610026041668, "lng": 106.60753851996527},
{"lat": 29.533612908854165, "lng": 106.60750813802083},
{"lat": 29.533613961805554, "lng": 106.60747911241319},
{"lat": 29.533614844618055, "lng": 106.60744927300347},
{"lat": 29.53361382855903, "lng": 106.6074191623264},
{"lat": 29.533611014756944, "lng": 106.60738606770833},
{"lat": 29.533609807725693, "lng": 106.60735622829861},
{"lat": 29.53360378689236, "lng": 106.60732421875},
{"lat": 29.533591753472223, "lng": 106.60729302300348},
{"lat": 29.533589952256943, "lng": 106.6072531467014},
{"lat": 29.533578830295138, "lng": 106.6072132703993},
{"lat": 29.533563910590278, "lng": 106.60718098958333},
{"lat": 29.533544921875, "lng": 106.60715277777778},
{"lat": 29.533516981336806, "lng": 106.60712782118055},
{"lat": 29.533491753472223, "lng": 106.60710394965278},
{"lat": 29.53346950954861, "lng": 106.60708875868056},
{"lat": 29.533448621961806, "lng": 106.6070738389757},
{"lat": 29.533423665364584, "lng": 106.60705376519097},
{"lat": 29.533394639756946, "lng": 106.60704399956597},
{"lat": 29.53337158203125, "lng": 106.607041015625},
{"lat": 29.533349609375, "lng": 106.60703884548612},
{"lat": 29.53332465277778, "lng": 106.60703884548612},
{"lat": 29.53329861111111, "lng": 106.60703776041667},
{"lat": 29.533269585503472, "lng": 106.60703586154514},
{"lat": 29.533238661024306, "lng": 106.60703884548612},
{"lat": 29.53320366753472, "lng": 106.6070458984375},
{"lat": 29.533169759114582, "lng": 106.60704779730902},
{"lat": 29.533138563368055, "lng": 106.6070458984375},
{"lat": 29.533111707899305, "lng": 106.60704779730902},
{"lat": 29.533083767361113, "lng": 106.60704888237848},
{"lat": 29.533058539496526, "lng": 106.60705783420138},
{"lat": 29.533029513888888, "lng": 106.60706081814236},
{"lat": 29.533001573350695, "lng": 106.60705783420138},
{"lat": 29.5329736328125, "lng": 106.60705891927083},
{"lat": 29.53294460720486, "lng": 106.60706298828126},
{"lat": 29.532916666666665, "lng": 106.60706597222222},
{"lat": 29.532889539930554, "lng": 106.60707085503472},
{"lat": 29.532861599392362, "lng": 106.6070738389757},
{"lat": 29.53282958984375, "lng": 106.60707275390625},
{"lat": 29.532801378038194, "lng": 106.60706298828126},
{"lat": 29.5327734375, "lng": 106.60706891927083},
{"lat": 29.53274929470486, "lng": 106.60706597222222},
{"lat": 29.532728407118057, "lng": 106.60706600911458},
{"lat": 29.532699381510415, "lng": 106.60706790798611},
{"lat": 29.53267333984375, "lng": 106.60706790798611},
{"lat": 29.532643500434027, "lng": 106.60707790798611},
{"lat": 29.532611490885415, "lng": 106.60707577473959},
{"lat": 29.532579481336807, "lng": 106.60707879557292},
{"lat": 29.532548285590277, "lng": 106.6070711485243},
{"lat": 29.53251925998264, "lng": 106.60707100260417},
{"lat": 29.532493489583334, "lng": 106.60707188541666},
{"lat": 29.532466362847224, "lng": 106.60707133836805},
{"lat": 29.532438422309028, "lng": 106.60707075217014},
{"lat": 29.532408311631944, "lng": 106.60706075217014},
{"lat": 29.532289496527778, "lng": 106.60705593532987}
]}