{
"id": "cqupt:taichi@vpr2",
"name": "太极运动场:跑道2",
"description": "重庆邮电大学-太极运动场-跑道2",
"version": 1,
"author": "Silver Wolf",
"coordinate_type": "GCJ02",
"points": [
{"lat": 29.532675238715278, "lng": 106.60937608506944},
{"lat": 29.532650282118055, "lng": 106.60937608506944},
{"lat": 29.532629123263888, "lng": 106.60937798394097},
{"lat": 29.53260715060764, "lng": 106.60938015407986},
{"lat": 29.532584092881944, "lng": 106.60938015407986},
{"lat": 29.532560221354167, "lng": 106.60937798394097},
{"lat": 29.5325390625, "lng": 106.60937798394097},
{"lat": 29.532515190972223, "lng": 106.60937798394097},
{"lat": 29.532494303385416, "lng": 106.60938015407986},
{"lat": 29.53247016059028, "lng": 106.60938313802083},
{"lat": 29.532449273003472, "lng": 106.60938802083334},
{"lat": 29.53242485894097, "lng": 106.6093931749132},
{"lat": 29.532403971354167, "lng": 106.60940104166667},
{"lat": 29.532381998697918, "lng": 106.60941514756945},
{"lat": 29.532361924913193, "lng": 106.60942599826389},
{"lat": 29.53234185112847, "lng": 106.60944091796875},
{"lat": 29.532323947482638, "lng": 106.60945502387153},
{"lat": 29.53230685763889, "lng": 106.60947102864583},
{"lat": 29.5322900390625, "lng": 106.60949001736111},
{"lat": 29.532274848090278, "lng": 106.60950602213542},
{"lat": 29.532259928385418, "lng": 106.60952609592015},
{"lat": 29.53224880642361, "lng": 106.60954508463541},
{"lat": 29.53223388671875, "lng": 106.60956814236111},
{"lat": 29.53222195095486, "lng": 106.60959011501735},
{"lat": 29.5322119140625, "lng": 106.60961317274305},
{"lat": 29.532204047309026, "lng": 106.60963812934028},
{"lat": 29.532197265625, "lng": 106.6096630859375},
{"lat": 29.53219211154514, "lng": 106.60969129774305},
{"lat": 29.532189127604166, "lng": 106.60971842447917},
{"lat": 29.53218505859375, "lng": 106.60974636501736},
{"lat": 29.53218505859375, "lng": 106.609775390625},
{"lat": 29.53218722873264, "lng": 106.60980143229166},
{"lat": 29.532190212673612, "lng": 106.6098304578993},
{"lat": 29.532194281684028, "lng": 106.60985622829861},
{"lat": 29.53220024956597, "lng": 106.6098814561632},
{"lat": 29.53220730251736, "lng": 106.60990831163194},
{"lat": 29.532215169270835, "lng": 106.60993326822917},
{"lat": 29.532225206163194, "lng": 106.60995849609375},
{"lat": 29.532237141927084, "lng": 106.60998372395834},
{"lat": 29.532249077690974, "lng": 106.61000651041667},
{"lat": 29.532264268663194, "lng": 106.61003065321181},
{"lat": 29.5322802734375, "lng": 106.61005154079861},
{"lat": 29.532299262152776, "lng": 106.61007568359375},
{"lat": 29.53231906467014, "lng": 106.6100954861111},
{"lat": 29.532339138454862, "lng": 106.61011149088542},
{"lat": 29.532359212239584, "lng": 106.61012668185764},
{"lat": 29.53238226996528, "lng": 106.61014350043403},
{"lat": 29.5324072265625, "lng": 106.61015652126736},
{"lat": 29.532430555555557, "lng": 106.61017062717013},
{"lat": 29.532457411024307, "lng": 106.6101806640625},
{"lat": 29.53250949435764, "lng": 106.61019070095486},
{"lat": 29.53253255208333, "lng": 106.61019151475695},
{"lat": 29.532560492621528, "lng": 106.61019368489583},
{"lat": 29.532587348090278, "lng": 106.61019558376736},
{"lat": 29.53261257595486, "lng": 106.6101966688368},
{"lat": 29.53263943142361, "lng": 106.6101966688368},
{"lat": 29.532664388020834, "lng": 106.61019558376736},
{"lat": 29.5326904296875, "lng": 106.61019558376736},
{"lat": 29.53271538628472, "lng": 106.6101966688368},
{"lat": 29.532740342881944, "lng": 106.61019558376736},
{"lat": 29.532764485677085, "lng": 106.61019368489583},
{"lat": 29.532787543402776, "lng": 106.6101939561632},
{"lat": 29.53281032986111, "lng": 106.61019151475695},
{"lat": 29.532835557725694, "lng": 106.6101917860243},
{"lat": 29.532859429253474, "lng": 106.6101917860243},
{"lat": 29.53288547092014, "lng": 106.61019097222223},
{"lat": 29.53291232638889, "lng": 106.6101917860243},
{"lat": 29.532937554253472, "lng": 106.6101939561632},
{"lat": 29.532964409722222, "lng": 106.6101939561632},
{"lat": 29.532989366319445, "lng": 106.6101939561632},
{"lat": 29.533014322916667, "lng": 106.6101939561632},
{"lat": 29.533042534722224, "lng": 106.6101917860243},
{"lat": 29.533067491319443, "lng": 106.6101917860243},
{"lat": 29.533092447916665, "lng": 106.6101917860243},
{"lat": 29.53311767578125, "lng": 106.6101917860243},
{"lat": 29.533140733506944, "lng": 106.6101917860243},
{"lat": 29.533164605034724, "lng": 106.61019097222223},
{"lat": 29.533187662760415, "lng": 106.61019097222223},
{"lat": 29.533209635416668, "lng": 106.61018880208333},
{"lat": 29.53323269314236, "lng": 106.61018880208333},
{"lat": 29.533255750868054, "lng": 106.61019097222223},
{"lat": 29.533279622395835, "lng": 106.61019097222223},
{"lat": 29.533302680121526, "lng": 106.61019097222223},
{"lat": 29.53332763671875, "lng": 106.61018880208333},
{"lat": 29.533352864583332, "lng": 106.61018690321181},
{"lat": 29.533377821180554, "lng": 106.61018391927084},
{"lat": 29.53340060763889, "lng": 106.61017578125},
{"lat": 29.5334228515625, "lng": 106.61016682942709},
{"lat": 29.533445638020833, "lng": 106.61015597873264},
{"lat": 29.533467610677082, "lng": 106.61014350043403},
{"lat": 29.533489854600695, "lng": 106.61012858072917},
{"lat": 29.533509657118056, "lng": 106.61011149088542},
{"lat": 29.53352783203125, "lng": 106.61009358723959},
{"lat": 29.533545735677084, "lng": 106.61007568359375},
{"lat": 29.533562825520832, "lng": 106.6100537109375},
{"lat": 29.533577745225696, "lng": 106.61003363715278},
{"lat": 29.533590766059028, "lng": 106.61001166449653},
{"lat": 29.533602701822918, "lng": 106.60998860677083},
{"lat": 29.533612738715277, "lng": 106.60995659722222},
{"lat": 29.53363064236111, "lng": 106.60991672092014},
{"lat": 29.53364284939236, "lng": 106.60988552517361},
{"lat": 29.533647732204862, "lng": 106.6098513454861},
{"lat": 29.53365478515625, "lng": 106.60982638888889},
{"lat": 29.533655598958333, "lng": 106.60980034722222},
{"lat": 29.533655598958333, "lng": 106.60977837456598},
{"lat": 29.53365478515625, "lng": 106.60975341796875},
{"lat": 29.533650716145832, "lng": 106.60973036024305},
{"lat": 29.53364963107639, "lng": 106.6097083875868},
{"lat": 29.533647732204862, "lng": 106.60968532986111},
{"lat": 29.533640679253473, "lng": 106.609658203125},
{"lat": 29.53362250434028, "lng": 106.60959635416667},
{"lat": 29.53361056857639, "lng": 106.60956515842014},
{"lat": 29.533597547743057, "lng": 106.60953314887153},
{"lat": 29.533579372829863, "lng": 106.60950493706598},
{"lat": 29.5335595703125, "lng": 106.60948296440972},
{"lat": 29.53353732638889, "lng": 106.60946017795139},
{"lat": 29.533517523871527, "lng": 106.60944010416667},
{"lat": 29.533497450086806, "lng": 106.60941813151042},
{"lat": 29.533472493489583, "lng": 106.60940592447916},
{"lat": 29.533445366753472, "lng": 106.6093931749132},
{"lat": 29.53342041015625, "lng": 106.60938313802083},
{"lat": 29.533394368489585, "lng": 106.60937608506944},
{"lat": 29.533365342881943, "lng": 106.60937093098958},
{"lat": 29.53334038628472, "lng": 106.60936794704861},
{"lat": 29.5333154296875, "lng": 106.60936496310764},
{"lat": 29.533289388020833, "lng": 106.60936116536459},
{"lat": 29.533260362413195, "lng": 106.60936116536459},
{"lat": 29.53323459201389, "lng": 106.60936116536459},
{"lat": 29.533207465277776, "lng": 106.60936604817708},
{"lat": 29.533184407552085, "lng": 106.60937093098958},
{"lat": 29.533160264756944, "lng": 106.60937093098958},
{"lat": 29.533139105902777, "lng": 106.60937310112847},
{"lat": 29.533115234375, "lng": 106.60937310112847},
{"lat": 29.533092176649305, "lng": 106.60937798394097},
{"lat": 29.533070203993056, "lng": 106.60938015407986},
{"lat": 29.53304714626736, "lng": 106.60937798394097},
{"lat": 29.53302029079861, "lng": 106.60937798394097},
{"lat": 29.532995062934027, "lng": 106.60937798394097},
{"lat": 29.532969292534723, "lng": 106.60937798394097},
{"lat": 29.532942165798612, "lng": 106.60937798394097},
{"lat": 29.532915310329862, "lng": 106.60938015407986},
{"lat": 29.53289008246528, "lng": 106.60937608506944},
{"lat": 29.532862141927083, "lng": 106.60937608506944},
{"lat": 29.532835286458333, "lng": 106.60937608506944},
{"lat": 29.532807074652776, "lng": 106.609375},
{"lat": 29.532782118055554, "lng": 106.609375},
{"lat": 29.532755262586807, "lng": 106.609375},
{"lat": 29.532730305989585, "lng": 106.60937310112847},
{"lat": 29.53270724826389, "lng": 106.609375},
{"lat": 29.53268012152778, "lng": 106.609375},
{"lat": 29.532675238715278, "lng": 106.60937608506944}
  ]
}