{
"id": "cqupt:fenghua@vpr1",
"name": "风华运动场:跑道1",
"description": "重庆邮电大学-风华运动场-跑道1",
"version": 1,
"author": "Silver Wolf",
"coordinate_type": "GCJ02",
"points":[
{"lat":29.532296549479167,"lng":106.60797173394097},
{"lat":29.53231662326389,"lng":106.60796956380209},
{"lat":29.53233669704861,"lng":106.60796956380209},
{"lat":29.532359754774305,"lng":106.60797471788194},
{"lat":29.532381727430554,"lng":106.60798177083333},
{"lat":29.532406684027777,"lng":106.60798366970486},
{"lat":29.532431640625,"lng":106.60797878689236},
{"lat":29.532459581163195,"lng":106.60797173394097},
{"lat":29.532486707899306,"lng":106.6079736328125},
{"lat":29.5325146484375,"lng":106.60797878689236},
{"lat":29.53254665798611,"lng":106.60798177083333},
{"lat":29.532574598524306,"lng":106.60798366970486},
{"lat":29.53259955512153,"lng":106.60798177083333},
{"lat":29.53262451171875,"lng":106.60797661675348},
{"lat":29.53264865451389,"lng":106.60797471788194},
{"lat":29.53267361111111,"lng":106.60797471788194},
{"lat":29.532696668836806,"lng":106.6079736328125},
{"lat":29.53272162543403,"lng":106.60797173394097},
{"lat":29.532744683159724,"lng":106.60797173394097},
{"lat":29.532769639756946,"lng":106.60796956380209},
{"lat":29.532796766493057,"lng":106.60796956380209},
{"lat":29.532823621961807,"lng":106.60796956380209},
{"lat":29.532849663628472,"lng":106.60796875},
{"lat":29.532876519097222,"lng":106.60796875},
{"lat":29.532901746961805,"lng":106.60796875},
{"lat":29.53292697482639,"lng":106.60796875},
{"lat":29.53295193142361,"lng":106.60796657986111},
{"lat":29.532974989149306,"lng":106.60796468098958},
{"lat":29.532998860677083,"lng":106.60796169704861},
{"lat":29.53302001953125,"lng":106.60796169704861},
{"lat":29.5330419921875,"lng":106.60796169704861},
{"lat":29.53306694878472,"lng":106.60796468098958},
{"lat":29.533090006510417,"lng":106.60796875},
{"lat":29.533116861979167,"lng":106.60796875},
{"lat":29.533143988715278,"lng":106.60796956380209},
{"lat":29.533170030381946,"lng":106.60796956380209},
{"lat":29.533196885850696,"lng":106.60796875},
{"lat":29.533221842447915,"lng":106.60796468098958},
{"lat":29.53324896918403,"lng":106.60795871310764},
{"lat":29.533276909722222,"lng":106.60795166015625},
{"lat":29.533307020399306,"lng":106.60794460720486},
{"lat":29.533336859809026,"lng":106.60793972439237},
{"lat":29.53336181640625,"lng":106.60793158637152},
{"lat":29.5333837890625,"lng":106.60791965060764},
{"lat":29.533398980034722,"lng":106.60789957682292},
{"lat":29.533413899739582,"lng":106.6078746202257},
{"lat":29.533428819444445,"lng":106.60784857855903},
{"lat":29.53343994140625,"lng":106.60782443576389},
{"lat":29.53345404730903,"lng":106.60779839409722},
{"lat":29.533464898003473,"lng":106.60776936848958},
{"lat":29.533474934895832,"lng":106.6077414279514},
{"lat":29.533484971788194,"lng":106.60771131727431},
{"lat":29.533492024739584,"lng":106.6076833767361},
{"lat":29.533498806423612,"lng":106.60765652126736},
{"lat":29.533501790364582,"lng":106.6076283094618},
{"lat":29.533501790364582,"lng":106.60759847005208},
{"lat":29.533501790364582,"lng":106.60756646050348},
{"lat":29.533498806423612,"lng":106.60753445095486},
{"lat":29.53349392361111,"lng":106.60750325520833},
{"lat":29.533489854600695,"lng":106.60747314453126},
{"lat":29.53348388671875,"lng":106.6074462890625},
{"lat":29.53347683376736,"lng":106.6074191623264},
{"lat":29.53346896701389,"lng":106.60739312065972},
{"lat":29.53345703125,"lng":106.60736626519098},
{"lat":29.533444010416666,"lng":106.60734103732639},
{"lat":29.533429904513888,"lng":106.60731906467014},
{"lat":29.533413899739582,"lng":106.60729817708334},
{"lat":29.533396809895834,"lng":106.6072740342882},
{"lat":29.53337863498264,"lng":106.60725423177084},
{"lat":29.53335666232639,"lng":106.60723415798611},
{"lat":29.533331705729168,"lng":106.60721896701389},
{"lat":29.533304578993057,"lng":106.60720377604167},
{"lat":29.533279622395835,"lng":106.6071888563368},
{"lat":29.53325656467014,"lng":106.60717800564237},
{"lat":29.53323459201389,"lng":106.60716878255208},
{"lat":29.533213704427084,"lng":106.60716281467013},
{"lat":29.533189561631943,"lng":106.60716281467013},
{"lat":29.533163519965278,"lng":106.60715901692708},
{"lat":29.533133680555554,"lng":106.60715576171874},
{"lat":29.533104654947916,"lng":106.60715277777778},
{"lat":29.53307861328125,"lng":106.60714599609375},
{"lat":29.53304958767361,"lng":106.60714789496528},
{"lat":29.533023546006945,"lng":106.60715087890625},
{"lat":29.532996690538194,"lng":106.60715386284723},
{"lat":29.532971733940972,"lng":106.60715386284723},
{"lat":29.532948676215277,"lng":106.60715576171874},
{"lat":29.532926703559028,"lng":106.60715901692708},
{"lat":29.532899576822917,"lng":106.60716091579862},
{"lat":29.53287163628472,"lng":106.60716091579862},
{"lat":29.5328466796875,"lng":106.60716281467013},
{"lat":29.532819552951388,"lng":106.6071657986111},
{"lat":29.532796766493057,"lng":106.60716878255208},
{"lat":29.532773708767362,"lng":106.60717095269098},
{"lat":29.53274848090278,"lng":106.60716878255208},
{"lat":29.532723253038196,"lng":106.60716389973959},
{"lat":29.532696397569445,"lng":106.60716281467013},
{"lat":29.53266845703125,"lng":106.60716281467013},
{"lat":29.53264133029514,"lng":106.60716389973959},
{"lat":29.532616373697916,"lng":106.6071657986111},
{"lat":29.532591417100694,"lng":106.6071657986111},
{"lat":29.532568359375,"lng":106.60716796875},
{"lat":29.53253933376736,"lng":106.60716389973959},
{"lat":29.532513292100695,"lng":106.60716281467013},
{"lat":29.532486436631945,"lng":106.60716091579862},
{"lat":29.532461480034723,"lng":106.60715901692708},
{"lat":29.532434353298612,"lng":106.60715793185764},
{"lat":29.53240939670139,"lng":106.60716281467013},
{"lat":29.532386338975694,"lng":106.60717393663194},
{"lat":29.532361382378472,"lng":106.6071839735243},
{"lat":29.53233344184028,"lng":106.60719292534722},
{"lat":29.532306315104165,"lng":106.6071959092882},
{"lat":29.532278374565973,"lng":106.60720377604167},
{"lat":29.53225341796875,"lng":106.60720893012153},
{"lat":29.532229275173613,"lng":106.60721896701389},
{"lat":29.532208387586806,"lng":106.60723578559028},
{"lat":29.532186414930557,"lng":106.60726101345486},
{"lat":29.532169325086805,"lng":106.60728895399305},
{"lat":29.53215847439236,"lng":106.60731418185765},
{"lat":29.53214626736111,"lng":106.60733913845486},
{"lat":29.53213134765625,"lng":106.60736409505208},
{"lat":29.53211642795139,"lng":106.60739312065972},
{"lat":29.532103407118054,"lng":106.60741617838542},
{"lat":29.532093370225695,"lng":106.60743815104166},
{"lat":29.53208441840278,"lng":106.60745903862848},
{"lat":29.53207845052083,"lng":106.60747911241319},
{"lat":29.532073296440974,"lng":106.6075062391493},
{"lat":29.532071397569446,"lng":106.60753119574653},
{"lat":29.532071397569446,"lng":106.60755913628472},
{"lat":29.532071397569446,"lng":106.60759114583334},
{"lat":29.532071397569446,"lng":106.60761908637153},
{"lat":29.532071397569446,"lng":106.60764431423611},
{"lat":29.532074381510416,"lng":106.60767333984376},
{"lat":29.532083333333333,"lng":106.6077064344618},
{"lat":29.532094455295137,"lng":106.60773654513889},
{"lat":29.53211127387153,"lng":106.60776638454861},
{"lat":29.532128363715277,"lng":106.6077964952257},
{"lat":29.53213948567708,"lng":106.60781955295138},
{"lat":29.532154405381945,"lng":106.60783854166667},
{"lat":29.532169325086805,"lng":106.6078564453125},
{"lat":29.532186414930557,"lng":106.60787434895833},
{"lat":29.532203504774305,"lng":106.60789143880208},
{"lat":29.53222140842014,"lng":106.60790635850694},
{"lat":29.532239583333332,"lng":106.60791965060764},
{"lat":29.53225857204861,"lng":106.60793158637152},
{"lat":29.53227973090278,"lng":106.60794460720486},
{"lat":29.532296549479167,"lng":106.60797173394097}
]
}